Names,Website,Introduction,Phone Number,Address,Type,Opens At,Municipio
Villa Marina Restaurante Ensenada,ggara.com,None Found,+52 646 175 8553,"Carr Tijuana-Ensenada km 104, 22760 El Sauzal, B.C., México",Marisquería, Abre a las 11a.m. del dom,Ensenada
Mr. Pampas Ensenada,mrpampas.com,None Found,+52 646 176 5154,"Esquina con Medusas, Lázaro Cárdenas 1790, Bahia Ensenada, 22880 Ensenada, B.C., México",Restaurante,,Ensenada
El Restaurante en Punta Morro,hotelpuntamorro.com,Alta cocina internacional en un espacio íntimo con bar y vista al mar en el Hotel Punta Morro.,+52 646 178 3507,"Carr. Tijuana-Ensenada km 106, 22860 Ensenada, B.C., México",Restaurante, 11p.m. ,Ensenada
Restaurant El Rey Sol,elreysol.com,Antiguo local familiar que sirve comida francesa y pastas en un comedor formal.,+52 646 178 1733,"Av Adolfo López Mateos 1000, Zona Centro, 22800 Ensenada, B.C., México",Restaurante francés, 10:30p.m. ,Ensenada
Calma Restaurante,,None Found,+52 646 978 1873,"Blvd. Costero 448, Zona Centro, 22800 Ensenada, B.C., México",Restaurante, Cierra a las 12a.m.,Ensenada
Muelle 3,,None Found,+52 646 174 0318,"Sobre el malecon, Paseo del Náutico, Paseo Olas Altas 187, Centro, 22870 Ensenada, B.C., México",Marisquería, Abre a las 12p.m. del mar,Ensenada
Mariscos Bahia De Ensenada,mariscosbahiadeensenada.com,None Found,+52 646 178 1015,"Av. Riveroll 109, Zona Centro, 22800 Ensenada, B.C., México",Marisquería, Abre a las 10a.m. del dom,Ensenada
Sano´s Steak House,,None Found,+52 646 174 4061,"Carr. Tijuana-Ensenada Km 108.5, Zona Playitas, 22860 Ensenada, B.C., México",Restaurante especializado en filetes, 11p.m. ,Ensenada
Cenaduria Tlaquepaque,,"Restaurante de bocadillos, comidas y postres tradicionales en un ambiente relajado.",+52 646 177 1466,"Calz. Cortez 327, Independencia, 22840 Ensenada, B.C., México",Restaurante mexicano, Cierra a las 11:45p.m.,Ensenada
La Guerrerense Carreta,laguerrerense.com,Simple y humilde carreta que ofrece manjares del mar y elaboran salsas propias en un ambiente reconocido.,+52 646 174 0006,"Av Adolfo López Mateos 917, Centro, 22800 Ensenada, B.C., México",Marisquería, Abre a las 9:30a.m. del dom,Ensenada
Il Maximo,,None Found,+52 646 977 7089,"Blvd Costero, Lázaro Cárdenas 987, Zona Centro, 22800 Ensenada, B.C., México",Restaurante italiano, Abre a las 2p.m. del dom,Ensenada
El Círculo Restaurante,bit.ly,None Found,0221 469-1334,"La Merced 151, Centro, B1925CYC, B1925 Ensenada, Provincia de Buenos Aires",Restaurante, Abre a las 12p.m. del lun,Ensenada
Las Cazuelas Restaurante,facebook.com,None Found,+52 646 176 1044,"Gral. Agustin Sanginés 6A, Carlos Pacheco 4, 22880 Ensenada, B.C., México",Restaurante, Abre a las 7a.m. del dom,Ensenada
La Concheria,,None Found,+52 646 978 4000,"Av. Miramar 637-9, Zona Centro, 22800 Ensenada, B.C., México",Marisquería, Abre a las 12p.m. del dom,Ensenada
260 Grill & Bar Restaurante Ensenada,facebook.com,Restaurante tranquilo con parrillas en las mesas para que los clientes cocinen sus propias carnes con sabores coreanos.,+52 646 182 7640,"Boulevard Lazaro Cardenas, La Marina #656-Interior B1, 22800 Ensenada, B.C., México",Restaurante, Cierra a las 12a.m.,Ensenada
Restaurante la Forchetta,facebook.com,Local con iluminación tenue y decorado con plantas que ofrece sangrías y comida italiana como pastas y pizzas.,+52 646 178 3408,"Av. Blancarte 7, Zona Centro, 22800 Ensenada, B.C., México",Restaurante italiano, Cierra a las 12a.m.,Ensenada
Casa Magnolia,,Comida mexicana e internacional con vino en un lugar sofisticado con paredes de cristal y vistas panorámicas.,+52 646 176 6592,"México 1, Carlos Pacheco 4, 22890 Ensenada, B.C., México",Restaurante, 11p.m. ,Ensenada
Birrieria La Guadalajara,,"Local con cocina abierta, donde se sirven estofados de carne de res, cabra y cordero con tortillas, tacos o frijoles fritos.",+52 646 174 0392,"Av. Macheros 154, Zona Centro, 22800 Ensenada, B.C., México",Restaurante mexicano, Abre a las 7a.m. del dom,Ensenada
Pranvera Ensenada,pranveramx.com,None Found,+52 646 190 9464,"AV.Gral. Jose de Jesus Clark 198 colonia Ampliación Moderna, Zona Playitas, 22870 Ensenada, B.C., México",Restaurante, Cierra a las 12a.m.,Ensenada
Finca Altozano Asador Campestre,fincaltozano.com,"Restaurante de carnes, mariscos y vinos locales con una terraza que tiene vista a los viñedos del valle de Guadalupe.",+52 646 688 1016,"Carretera Tecate - Ensenada, Ejido Km 83, 22750 Francisco Zarco, B.C., México",Restaurante, Abre a las 12p.m. del dom,Ensenada
COMAL Restaurante,instagram.com,None Found,+52 646 295 1920,"Plaza Santo Tomás, Av. Miramar 667-Local 17, Zona Centro, 22800 Ensenada, B.C., México",Restaurante mexicano,,Ensenada
El Corralito Restaurant,facebook.com,None Found,+52 646 178 2370,"Av Adolfo López Mateos 627, Zona Centro, 22800 Ensenada, B.C., México",Restaurante mexicano, Cierra a las 2a.m.,Ensenada
Taquería el Trailero,,None Found,+52 646 204 7678,"Carretera Transpeninsular Ensenada, Carr. a Tijuana no. 353, El Sauzal, 22760 Ensenada, B.C., México",Taquería, Cierra a las 2a.m.,Ensenada
La Kasita Del Sr. Omelette,facebook.com,None Found,+52 646 204 3733,"C. Diez 835, Ampliacion Reforma, 22830 Ensenada, B.C., México",Restaurante, Abre a las 7:30a.m. del dom,Ensenada
El Patio Ens - Restaurante Bar,facebook.com,None Found,+52 646 178 3866,"Av Adolfo López Mateos 1088, Zona Centro, 22800 Ensenada, B.C., México",Bar restaurante,,Ensenada
Madre,,None Found,+52 646 183 7588,"C. Octava 444, Zona Centro, 22800 Ensenada, B.C., México",Restaurante,,Ensenada
La Hoguera,,None Found,+52 646 244 5150,"Av. Gastélum 597, Zona Centro, 22800 Ensenada, B.C., México",Parrilla, Abre a la 1p.m. del dom,Ensenada
Restaurante Barra Azul,,None Found,+52 646 178 4846,"Obrera, 22830 Ensenada, B.C., México",Marisquería, Abre a la 1p.m. del dom,Ensenada
Mahi Mahi,mahimahi.com.mx,None Found,+52 646 178 3494,"P.º Miguel Hidalgo y Costilla 33, Ignacio Altamirano, 22870 Ensenada, B.C., México",Marisquería, Abre a las 12p.m. del dom,Ensenada
Los Carbones,facebook.com,None Found,+52 646 172 5460,"Bucaneros 203, Playa Ensenada, 22880 Ensenada, B.C., México",Restaurante, Cierra a las 2a.m.,Ensenada
Tacos Marco Antonio,,None Found,+52 646 131 6746,"Av Rayon 351, Obrera, 22830 Ensenada, B.C., México",Taquería, Abre a las 9:30a.m. del dom,Ensenada
La Cienega Restaurante,instagram.com,None Found,+52 646 977 2527,"Playa Ensenada, 22880 Ensenada, B.C., México",Restaurante de desayunos, Abre a las 9a.m. del dom,Ensenada
"La Ensenada, Restaurante",laensenadarestaurante.com,None Found,+52 646 156 5030,"Av Adolfo López Mateos 1090-5, entre Castillo y Blancarte, Centro, Zona Centro, 22800 Ensenada, B.C., México",Restaurante mexicano, 11p.m. ,Ensenada
La Cocedora De Langosta,m.facebook.com,None Found,+52 646 178 3742,"La Marina, Zona Centro, 22800 Ensenada, B.C., México",Marisquería, Abre a las 12p.m. del dom,Ensenada
Ola Negra,,None Found,+52 646 468 5491,"Av. Abelardo L. Rodriguez 22880, Nueva Ensenada, 22880 Ensenada, B.C., México",Marisquería,,Ensenada
Manzanilla,rmanzanilla.com,Aclamado chef Benito Molina presenta alta cocina mexicana con un toque Mediterráneo y vinos en un lugar chic.,+52 646 175 7073,"Blvd. Teniente Azueta 139, Zona Centro, 22800 Ensenada, B.C., México",Restaurante, 11p.m. ,Ensenada
Restaurant Rincón de la Ensenada,rincondelaensenada.cl,None Found,+56 9 6696 9497,"Ruta 225 km43, 5550000 Puerto Varas, Los Lagos, Chile",Restaurante, Abre a la 1p.m.,Ensenada
El Mesón de Ensenada,elmesondeensenada.com,None Found,+52 646 174 0155,"Av Adolfo López Mateos 914-5, Zona Centro, 22800 Ensenada, B.C., México",Restaurante, 10:30p.m. ,Ensenada
La Cocina Del Fat,lacocinadelfat.com,None Found,+52 646 204 7818,"José María Morelos y Pavón 116, Chapultepec, 22785 Ensenada, B.C., México",Restaurante, Abre a las 8a.m. del dom,Ensenada
Restaurante La Hacienda,lahaciendaresta.com,Sereno lugar al aire libre rodeado de flores y plantas con menú de platillos mexicanos tradicionales.,+52 646 155 3160,"Santos Degollado 444, 22766 Villa de Juárez, B.C., México",Restaurante mexicano, Abre a las 7a.m. del dom,Ensenada
Mariscos la Doña,facebook.com,None Found,+52 646 184 7097,"Las Dunas, Calle De Las Rocas &, Playa Ensenada, 22880 Ensenada, B.C., México",Marisquería, Abre a las 11a.m. del dom,Ensenada
Maria Camelia Restaurante- Suc. Blvd.,mariacameliarestaurante.com,None Found,+52 646 596 5297,"Blvd. Costero 263, Zona Centro, 22800 Ensenada, B.C., México",Restaurante, Abre a las 9a.m. del dom,Ensenada
Santo Mitote,facebook.com,"Cocina mexicana y opciones internacionales en un sitio moderno con terraza, servicio al bar y música en vivo.",+52 646 173 2017,"Macroplaza Del Mar, Av. Dr Pedro Loyola 612-local 58-59, Carlos Pacheco, Carlos Pacheco 8, 22830 Ensenada, B.C., México",Restaurante, Abre a las 8a.m. del dom,Ensenada
Mariscos El Güero,,None Found,+52 646 269 5151,"Gastélum, Calle 13 y, Zona Centro, 22800 Ensenada, B.C., México",Marisquería, Abre a las 9a.m. del dom,Ensenada
Los Veleros Restaurante,hotelcorona.com.mx,None Found,+52 646 176 0901,"Corona Hotel & Spa, Lázaro Cárdenas 1442, Bahia Ensenada, 22880 Ensenada, B.C., México",Restaurante mexicano, 11p.m. ,Ensenada
LA COCINA DE LUPITA,facebook.com,None Found,+52 646 175 3477,"AV RIVEROLL #1424, Int: 4, CENTRO, 22800 Ensenada, B.C., México",Restaurante, Abre a las 7a.m. del dom,Ensenada
El Parian,,None Found,+52 646 178 8232,"Av. Castillo 401, Centro, 22800 Ensenada, B.C., México",Restaurante mexicano, 11p.m. ,Ensenada
Capitan Cahuama Ensenada,,None Found,+52 646 194 4119,"Blvd. Costero 510, entre GUAYMAS Y PLINTA, Acapulco, 22890 Ensenada, B.C., México",Restaurante,,Ensenada
Clara Restaurante,clararestaurante.com,None Found,+52 646 978 2440,"Av Adolfo López Mateos Esquina con Riveroll Zona Centro, 22800 Ensenada, B.C., México",Restaurante de brunch, Abre a las 8a.m. del dom,Ensenada
Victor's Restaurant,,None Found,+52 646 176 1313,"Boulevard Costero, Lázaro Cárdenas 178, Zona Centro, 22800 Ensenada, B.C., México",Restaurante americano, Abre a las 7a.m. del dom,Ensenada
Mexipon Ramen & Curry Bar,mexipon.com,None Found,+52 646 175 7899,"Virgilio Uribe 649, Zona Centro, 22800 Ensenada, B.C., México",Restaurante especializado en ramen, Abre a la 1p.m. del dom,Ensenada
Fauna Tasting Room Ensenada,cervezafauna.com,None Found,,"C. Tercera 1282, Zona Centro, 22830 Ensenada, B.C., México",Cervecería artesanal, Cierra a las 12a.m.,Ensenada
La Cocina de Doña Esthela,facebook.com,None Found,+52 646 156 8453,"Ranchos, San Marcos, El Porvenir, 22755 San Marcos, B.C., México",Restaurante mexicano, Abre a las 8a.m. del dom,Ensenada
Bronco's Steak House,broncossteaks.com,"Parrilladas, cocina mexicana y buffet de desayunos en un lugar cálido con estilo campestre y aire vaquero.",+52 646 176 4900,"Av Adolfo López Mateos 1525, Obrera, 22830 Ensenada, B.C., México",Restaurante especializado en filetes, Abre a las 9a.m. del dom,Ensenada
Restaurant Alebrije Ensenada,facebook.com,None Found,+52 646 977 1979,"Av. Ruiz 1488, Zona Centro, 22800 Ensenada, B.C., México",Restaurante, Abre a las 8a.m. del dom,Ensenada
Casa Marcelo,restaurantwebexperts.com,None Found,+52 646 187 3158,"Av. Riveroll 771, Zona Centro, 22800 Ensenada, B.C., México",Restaurante, Abre a las 8a.m. del dom,Ensenada
Sabina Restaurante por La Guerrerense,,None Found,+52 646 174 0006,"Av Adolfo López Mateos 917, Zona Centro, 22800 Ensenada, B.C., México",Marisquería,,Ensenada
Tacos Fénix,instagram.com,Puesto sencillo famoso por la selección de tacos con mariscos para llevar.,+52 646 977 1191,"Av. Espinoza 451, Obrera, 22830 Ensenada, B.C., México",Taquería, Abre a las 7a.m. del dom,Ensenada
Náutico Restaurante,facebook.com,None Found,0221 460-1147,"San Martín 1125, B1925BPU Ensenada, Provincia de Buenos Aires",Restaurante, Abre a las 11:30a.m.,Ensenada
Entre Brasas,facebook.com,None Found,+52 646 134 9308,"22800, Tercer Ayuntamiento, 22800 Ensenada, B.C., México",Restaurante, Abre a la 1p.m. del dom,Ensenada
Malay Restaurante,instagram.com,None Found,,"Lázaro Cárdenas 1618, Colonia Bahia, 22880 Ensenada, B.C., México",Restaurante,,Ensenada
La Cevicheria Oyster Bar,m.facebook.com,None Found,+52 646 188 9293,"Av. Alvarado 285, Zona Centro, 22800 Ensenada, B.C., México",Bar restaurante de ostras, Abre a las 11a.m. del dom,Ensenada
Restaurante El Primo Nava,facebook.com,Restaurante popular en el que se preparan platillos de mariscos clásicos en un ambiente informal y amplio.,+52 646 204 4206,"Av. Castillo 645, Zona Centro, 22800 Ensenada, B.C., México",Marisquería, Abre a las 10a.m. del dom,Ensenada
Pancake Place Ensenada,facebook.com,None Found,+52 646 120 5545,"Blvd. Costero 1982, Playa Ensenada, 22880 Ensenada, B.C., México",Restaurante de pancakes, Abre a las 7a.m. del dom,Ensenada
"Comedor Del Pueblo ""Todos Santos""",,None Found,+52 646 205 4089,"Lago de Xochimilco 962, Valle Dorado, 22890 Ensenada, B.C., México",Restaurante mexicano, Abre a las 8a.m. del dom,Ensenada
Deckman´s en el Mogor,deckmans.com,Rancho y viñedo con restaurante rústico al aire libre en donde se ofrece menú artesanal acompañado de vinos.,+1 619-721-4820,"Carretera Ensenada-Tecate Km. 85.5 San Antonio de Las Minas, 22753 Francisco Zarco, B.C., México",Restaurante,,Ensenada
La Llenadera,facebook.com,None Found,+52 646 978 3020,"Blvd. Costero, Acapulco, 22890 Ensenada, B.C., México",Restaurante, 11p.m. ,Ensenada
Tacos Angelito,,None Found,+52 646 273 6991,"Prolongacion, Calz. Cortez 143, Independencia, 22840 Ensenada, B.C., México",Taquería, Cierra a las 2a.m.,Ensenada
NIMA Grill Ensenada,nimagrill.com,None Found,+52 646 268 0551,"San Francisco 1151-4, Mision, 22830 Ensenada, B.C., México",Restaurante, Abre a las 9a.m. del mar,Ensenada
El Buen Provecho,,"Restaurante sencillo que ofrece desayunos y almuerzo clásicos americanos y mexicanos, café y jugos",+52 646 178 1184,"Av. Gastélum 80, Zona Centro, 22870 Ensenada, B.C., México",Restaurante, Abre a las 6a.m. del dom,Ensenada
Q Restaurante,es-es.facebook.com,None Found,+52 646 120 5235,"Blvd. Señor Adolfo Ramirez Mendez 830, Bahia, 22800 Ensenada, B.C., México",Restaurante,,Ensenada
Mariscos el Coyote,,None Found,,"C. De Las Brisas, Playa Ensenada, 22880 Ensenada, B.C., México",Marisquería, Abre a las 10a.m. del dom,Ensenada
Taninos Restaurante,,None Found,+52 646 200 7796,"Avenida Adolfo López Mateos & Avenida Hidalgo, Obrera, 22880 Ensenada, B.C., México",Restaurante, Abre a las 7a.m. del dom,Ensenada
HUNTER Coffee & Bistro,huntercoffeebistro.com,None Found,+52 646 978 8168,"Av Adolfo López Mateos #853, Zona Centro, 22800 Ensenada, B.C., México",Cafetería, 11p.m. ,Ensenada
Restaurante Tamarindos,,None Found,+52 646 173 4767,"Cuarta 940, Zona Centro, 22800 Ensenada, B.C., México",Restaurante mexicano, Abre a las 7:30a.m. del dom,Ensenada
Punta Ensenada,,None Found,+52 33 3178 4220,"Paulino Navarro 555, Los Maestros, 45150 Zapopan, Jal., México",Restaurante mexicano, Abre a la 1p.m. del dom,Ensenada
Maria Camelia Restaurante,facebook.com,None Found,+52 646 977 9667,"Av. Álvaro Obregón 350, entre 3era y Cuarta, Zona Centro, 22800 Ensenada, B.C., México",Restaurante mexicano, Abre a las 8a.m. del dom,Ensenada
Animalón,animalonbaja.com,None Found,+52 664 375 2658,"Km 93.5 Carretera Federal 3 San Antonio de las Minas, 22761 Ensenada, B.C., México",Restaurante de alta cocina, Abre a la 1p.m. del dom,Ensenada
El Güero Ens 1981,,None Found,+52 646 121 9332,"Av. Alvarado, Zona Centro, 22800 Ensenada, B.C., México",Marisquería, Abre a las 10a.m. del dom,Ensenada
i-Petra Restaurant,,None Found,+52 81 3570 7726,"Carretera Francisco Zarco - El Tigre KM 11.5 Delegación El Porvenir, 22750 Francisco Zarco, B.C., México",Restaurante, 11p.m. ,Ensenada
Haliotis Restaurant,facebook.com,"Menú extenso de cocina mexicana del mar y de la tierra en un sitio refinado con vitrales, terraza y jardín.",+52 646 176 3720,"Av. Delante 179, Nueva Ensenada, 22880 Ensenada, B.C., México",Marisquería, Abre a las 12p.m. del dom,Ensenada
Las Parrillas,,None Found,+52 646 176 1728,"Calle Sexta 1400, Obrera, 22830 Ensenada, B.C., México",Restaurante mexicano, Abre a las 7a.m. del dom,Ensenada
Baja México Restaurante,facebook.com,None Found,+52 646 362 8922,"C. Sexta y Espinoza 597, Obrera, 22830 Ensenada, B.C., México",Restaurante mexicano, Abre a las 9a.m. del dom,Ensenada
Bistro Lo Natural - Restaurante,facebook.com,None Found,+52 646 173 5757,"Av Hidalgo 180, Obrera, 22830 Ensenada, B.C., México",Restaurante, Abre a las 7a.m. del dom,Ensenada
La Cuarta Restaurante,facebook.com,None Found,+52 646 248 9746,"Cuarta #1051, Zona Centro, 22800 Ensenada, B.C., México",Restaurante mexicano, Abre a las 7a.m. del dom,Ensenada
Restaurante El Charro,,None Found,+52 646 178 2114,"Av Adolfo López Mateos 454, Zona Centro, 22800 Ensenada, B.C., México",Restaurante mexicano, Abre a las 10a.m. del dom,Ensenada
Chef Guevara Parrilla Argentina,,None Found,+52 646 240 2157,"Av. Ryerson 213, Centro, Zona Centro, 22870 Ensenada, B.C., México",Restaurante argentino, Abre a la 1p.m. del dom,Ensenada
El Paisa Tacos,,None Found,,"Av. 20 de Noviembre 1043, Zona Centro, 22800 Ensenada, B.C., México",Taquería, Cierra a la 1a.m.,Ensenada
La Patrona Antojería,,None Found,+52 646 206 6290,"C. Segunda 1380, entre floresta y Espinoza, Zona Centro, 22800 Ensenada, B.C., México",Restaurante mexicano, Abre a las 9a.m. del dom,Ensenada
Corona del Valle,coronadelvalle.com.mx,None Found,+52 646 116 2440,"Carretera Tecate-Ensenada KM 89 +100, 22760 Francisco Zarco, B.C., México",Viñedo,,Ensenada
Rinconcito Oaxaqueño,m.me,None Found,+52 646 152 1985,"Av. Abelardo L. Rodriguez Loc 15, Nueva Ensenada, 22887 Ensenada, B.C., México",Restaurante mexicano, Abre a las 9a.m. del dom,Ensenada
Las Cazuelitas Restaurant Bar,facebook.com,None Found,+52 646 175 7486,"Blvd. Costero 609-Local 11-12, Zona Centro, 22800 Ensenada, B.C., México",Restaurante mexicano, Abre a las 8a.m. del dom,Ensenada
da Toni,facebook.com,None Found,+52 646 113 4338,"Av. Riveroll 143, Centro, 22800 Ensenada, B.C., México",Restaurante de alta cocina, Abre a las 2p.m. del dom,Ensenada
El Pandita,,None Found,+52 646 176 3121,"C. Novena 216, Bustamante, 22840 Ensenada, B.C., México",Restaurante, Abre a las 10a.m. del dom,Ensenada
Baja Frut,,"Jugos, frutas antojitos y platos sencillos con sabor mexicano servidos en un moderno pero casual café.",+52 646 176 5638,"Av Adolfo López Mateos 1650-A, Obrera, 22830 Ensenada, B.C., México",Restaurante de brunch,,Ensenada
Breggfast restaurante,,None Found,+52 646 978 6982,"Av Adolfo López Mateos 2184-A, Granados, 22840 Ensenada, B.C., México",Restaurante de desayunos, Abre a las 7a.m. del dom,Ensenada
"Restaurante Latitud 32, Valle de Guadalupe",vinoselcielo.com,None Found,+52 646 978 0012,"Carretera El Tigre - El Porvenir KM 7.5 Parcela 118, 22755 El Porvenir, B.C., México",Restaurante, Abre a las 8a.m. del dom,Ensenada
La Flor De La Calabaza,,None Found,+52 646 174 4092,"km -ensenada, Carr. Tijuana-Ensenada 108, Zona Playitas, 22760 Ensenada, B.C., México",Restaurante de desayunos,,Ensenada
Dogos Sonora Ensenada,,None Found,+52 646 162 6797,"Avenida Mariano Abasolo & Calzada Cortez, Supermanzana 217, Independencia, 22840 Ensenada, B.C., México",Restaurante de perritos calientes, Cierra a la 1a.m.,Ensenada
Restaurante ChilakilEns - Chilaquiles & Grill,,None Found,+52 646 107 4295,"Av. Castillo 728, Zona Centro, 22800 Ensenada, B.C., México",Restaurante, Abre a las 8a.m. del dom,Ensenada
Restaurante ChilakilEns - Chilaquiles & Grill,,None Found,+52 646 107 4295,"Av. Castillo 728, Zona Centro, 22800 Ensenada, B.C., México",Restaurante, Abre a las 8a.m. del dom,Ensenada
La Blaseñita,,None Found,+52 646 418 9359,"Av. Espinoza 699, Obrera, 22800 Ensenada, B.C., México",Restaurante mexicano, Abre a las 10a.m. del dom,Ensenada
Mitos Mezcaleria y Restaurante,instagram.com,None Found,+52 646 129 0921,"Blvd. Costero 263, Zona Centro, 22800 Ensenada, B.C., México",Restaurante, Cierra a las 12a.m.,Ensenada
Olivea Farm to Table,oliveafarmtotable.com,None Found,+52 646 383 6402,"México 3 Km 92.5, 22766 Villa de Juárez, B.C., México",Restaurante, Abre a las 3p.m. del dom,Ensenada
Restaurante Michoacan,facebook.com,None Found,+52 646 206 3450,"Av. Ruiz 1205, Zona Centro, 22800 Ensenada, B.C., México",Restaurante mexicano, Abre a las 8a.m. del dom,Ensenada
Meson Leonardo's,,None Found,+52 646 155 3003,"Avenida A #270, 22766 Villa de Juárez, B.C., México",Restaurante mexicano, Abre a las 7a.m. del dom,Ensenada
La Carreta street’s seafood,facebook.com,None Found,+52 646 176 9313,"C. Cuarta 2097, Hidalgo, 22880 Ensenada, B.C., México",Marisquería, Abre a las 12p.m. del dom,Ensenada
La Carreta street’s seafood,facebook.com,None Found,+52 646 176 9313,"C. Cuarta 2097, Hidalgo, 22880 Ensenada, B.C., México",Marisquería, Abre a las 12p.m. del dom,Ensenada
"Mariscos ""El Chava"" del boulevard",facebook.com,None Found,+52 646 273 9717,"Caracoles 44, Playa Ensenada, 22880 Ensenada, B.C., México",Marisquería, Abre a las 9a.m. del dom,Ensenada
Hacienda Y Hostal San Angel,,"Carnes asadas y sabores de México en una hacienda elegante con asientos al aire libre, jardín grande y hotel.",+52 646 175 7311,"C. Diez 780, Zona Centro, 22800 Ensenada, B.C., México",Restaurante mexicano, Abre a las 8a.m. del dom,Ensenada
Buenos Aires Sabores Argentinos,,None Found,+52 646 248 4866,"C. Séptima 1891, Obrera, 22830 Ensenada, B.C., México",Restaurante argentino, Abre a la 1p.m. del dom,Ensenada
Restaurante Mariscos Playa Azul,,None Found,+52 646 174 0622,"Av. Riveroll 113, Zona Centro, 22800 Ensenada, B.C., México",Marisquería, Abre a las 11a.m. del dom,Ensenada
Luz de Luna Terraza,,None Found,+52 646 109 2170,"Av Rayon 178, Obrera, 22830 Ensenada, B.C., México",Restaurante de desayunos, Abre a las 8a.m. del dom,Ensenada
Tacos Castillo,,None Found,+52 646 175 7882,"Av. Castillo 456, Centro, 22800 Ensenada, B.C., México",Taquería, Abre a las 7a.m. del dom,Ensenada
Los Primos,facebook.com,None Found,+52 646 178 1741,"Av. Riveroll 462-2, Zona Centro, 22800 Ensenada, B.C., México",Marisquería, Abre a las 11a.m. del dom,Ensenada
La Avioneta,,None Found,+52 646 176 0606,"C. Séptima 1840, Obrera, 22880 Ensenada, B.C., México",Restaurante mexicano, Abre a las 9a.m. del dom,Ensenada
Birrieria Rodríguez,,None Found,+52 646 118 0785,"Av. Diamante 312, Nueva Ensenada, 22880 Ensenada, B.C., México",Restaurante de comida rápida, Abre a las 6a.m. del dom,Ensenada
Cumbre 400,cumbre400.com,None Found,+52 646 210 1362,"Boulevard Cumbre 400, 22785 Ensenada, B.C., México",Restaurante mexicano,,Ensenada
Cumbre 400,cumbre400.com,None Found,+52 646 210 1362,"Boulevard Cumbre 400, 22785 Ensenada, B.C., México",Restaurante mexicano,,Ensenada
Mr. & Mrs. Waffle,restaurantwebexperts.com,None Found,+52 646 205 1245,"México 1 1277, Centro, 22800 Ensenada, B.C., México",Restaurante de desayunos, Abre a las 8a.m. del dom,Ensenada
