Names,Website,Introduction,Phone Number,Address,Type,Opens At,Municipio
Bar Océano,facebook.com,None Found,+52 322 222 4294,"Paseo Díaz Ordaz 538, Centro, 48300 Puerto Vallarta, Jal., México",Restaurante mexicano, Abre a las 8a.m.,Puerto Vallarta
Vallarta Factory Restaurant Bar,vallartafactory.mx,None Found,+52 322 222 0300,"Libertad 100, Centro, 48300 Puerto Vallarta, Jal., México",Bar restaurante, Abre a las 9a.m.,Puerto Vallarta
Langostinos Restaurant & Bar,,"Restaurante festivo con palapas en la arena y música en vivo ocasional que sirve mariscos, carnes y pastas.",+52 322 222 0894,"Playa de los Muertos, Manuel M. Dieguez 109, Zona Romántica, Emiliano Zapata, 48380 Puerto Vallarta, Jal., México",Marisquería, Abre a las 8a.m.,Puerto Vallarta
MARLOW'S by Roberto,marlows.mx,None Found,+52 322 294 5957,"Basilio Badillo 277, Zona Romántica, Emiliano Zapata, 48380 Puerto Vallarta, Jal., México",Restaurante, Abre a las 5p.m.,Puerto Vallarta
Bubba Gump Aeropuerto,bubbagump.mx,None Found,+52 322 221 2167,"Blvd. Francisco Medina Ascencio 2141, Área Militar de Vallarta, 48339 Puerto Vallarta, Jal., México",Marisquería, Abre a las 9a.m.,Puerto Vallarta
Le Kliff,lekliff.com,Mariscos y alta cocina mexicana en un romántico restaurante sobre un risco junto al mar con ambiente tropical.,+52 322 121 4935,"Road to Barra de Navidad KM 17.5, Between, Mismaloya, Boca de Tomatlán, México",Restaurante de alta cocina, Abre a las 5p.m.,Puerto Vallarta
Le Kliff,lekliff.com,Mariscos y alta cocina mexicana en un romántico restaurante sobre un risco junto al mar con ambiente tropical.,+52 322 121 4935,"Road to Barra de Navidad KM 17.5, Between, Mismaloya, Boca de Tomatlán, México",Restaurante de alta cocina, Abre a las 5p.m.,Puerto Vallarta
El Faro Marina Vallarta,elfaromarinavallarta.com,None Found,+52 322 104 5542,"Esquina con, Paseo de la Marina, Timón 245, 48335 Puerto Vallarta, Jal., México",Restaurante,,Puerto Vallarta
La Ribera Steakhouse,velasvallarta.com,Parrilladas y sabores de España y México en un sitio elegante con vista al mar en el resort Velas Vallarta.,+52 322 226 9534,"Av Paseo de la Marina Nte 585, Marina Vallarta, 48354 Puerto Vallarta, Jal., México",Restaurante especializado en filetes, Abre a las 7:30a.m.,Puerto Vallarta
La Ribera Steakhouse,velasvallarta.com,Parrilladas y sabores de España y México en un sitio elegante con vista al mar en el resort Velas Vallarta.,+52 322 226 9534,"Av Paseo de la Marina Nte 585, Marina Vallarta, 48354 Puerto Vallarta, Jal., México",Restaurante especializado en filetes, Abre a las 7:30a.m.,Puerto Vallarta
Karuma The Art of Grill,karumatheartofgrill.com,None Found,+52 322 176 0685,"TierraLuna Gardens Puerto Vallarta, Carr. Costera a Barra de Navidad KM 7.5, 48390 Puerto Vallarta, Jal., México",Restaurante, Abre a las 3p.m.,Puerto Vallarta
Restaurante 3 ️C Puerto Vallarta,facebook.com,None Found,+52 322 159 1252,"C. 16 de Septiembre 279a, La Floresta, 48290 Puerto Vallarta, Jal., México",Marisquería, Abre a la 1p.m.,Puerto Vallarta
Restaurante 3 ️C Puerto Vallarta,facebook.com,None Found,+52 322 159 1252,"C. 16 de Septiembre 279a, La Floresta, 48290 Puerto Vallarta, Jal., México",Marisquería, Abre a la 1p.m.,Puerto Vallarta
NOROC,norocpv.com,None Found,+52 322 121 8852,"Basilio Badillo 101, Zona Romántica, Colonia Emiliano, 48380 Puerto Vallarta, Jal., México",Alimentación y bebida, Abre a las 11a.m.,Puerto Vallarta
NOROC,norocpv.com,None Found,+52 322 121 8852,"Basilio Badillo 101, Zona Romántica, Colonia Emiliano, 48380 Puerto Vallarta, Jal., México",Alimentación y bebida, Abre a las 11a.m.,Puerto Vallarta
Si Señor GARDEN,siseñorgardenpv.com,Platillos regionales de México en un edificio colonial rodeado con un frondoso jardín de terrazas múltiples.,+52 322 113 0064,"Josefa Ortiz de Domínguez 274, Centro, 48300 Puerto Vallarta, Jal., México",Restaurante mexicano, Abre a las 12p.m.,Puerto Vallarta
