Names,Website,Introduction,Phone Number,Address,Type,Opens At,Municipio
El Mesón Principal,mesonprincipal.com,"Carnes a las brasas, como res y cabra, servidas en un comedor luminoso con arcos de piedra y mariachis.",+52 844 415 0015,"Blvd. Venustiano Carranza 4671, Virreyes Residencial, 25230 Saltillo, Coah., México",Restaurante mexicano,,Saltillo
Don Artemio,donartemio.com,"Moderna cocina mexicana de autor, mezcales y vinos regionales en un enorme restaurante de refinada decoración.",+52 844 432 5550,"Blvd. Venustiano Carranza 8550, Valle Hermoso, 25207 Saltillo, Coah., México",Restaurante mexicano, Cierra a las 12a.m.,Saltillo
Los Compadres,loscompadres.mx,"Local de ambiente colonial, con una terraza encantadora y frondosa, donde se ofrecen platos tradicionales.",+52 844 174 0489,"Lic. Benito Juárez 463, Zona Centro, 25000 Saltillo, Coah., México",Restaurante mexicano, Cierra a las 12a.m.,Saltillo
Las Delicias de Mi General,,None Found,,"Lic. Juan Antonio de La Fuente Ote. 218, Zona Centro, 25025 Saltillo, Coah., México",Restaurante mexicano, Cierra a las 12a.m.,Saltillo
Mochomos Saltillo,mochomos.mx,None Found,+52 844 807 6682,"Blvd. Venustiano Carranza, Sin Nombre de Col 16, 25210 Saltillo, Coah., México",Restaurante, Cierra a las 2a.m.,Saltillo
Asador La Vaca Argentina,lavaca-argentina.com,"Asador con menú de carnes, pizzas y platos argentinos ofrecidos en un cálido comedor con paredes de ladrillo.",+52 844 410 1208,"Calle Ignacio Allende 1240, Zona Centro, 25000 Saltillo, Coah., México",Restaurante argentino, Cierra a las 11p.m.,Saltillo
Las Brazas,lasbrazas.com,"Comedor concurrido con porciones generosas de platos mexicanos, como tacos, quesadillas y enchiladas.",+52 844 415 5690,"Blvd. Venustiano Carranza 3070, Latinoamericana, 25270 Saltillo, Coah., México",Restaurante mexicano,,Saltillo
El Feligrez Steak House,facebook.com,"Cortes de carne y sabores internacionales en un sitio con decoraciones en madera, cuadros de arte y terraza.",+52 844 439 1199,"Blvd. Venustiano Carranza 3845, Virreyes Residencial, 25240 Saltillo, Coah., México",Restaurante especializado en filetes, Cierra a las 2a.m.,Saltillo
Pour La France,pourlafrance.com.mx,Bistró respetado con platos mexicano-franceses para toda ocasión.,+52 844 450 5000,"Perif. Luis Echeverría 1416, Guanajuato, 25280 Saltillo, Coah., México",Restaurante, Cierra a las 11p.m.,Saltillo
La Canasta,facebook.com,Legendario restaurante de ladrillo expuesto y pisos de loza que ofrece un amplio menú de platillos mexicanos.,+52 844 415 8050,"Blvd. Venustiano Carranza 2485, República, 25280 Saltillo, Coah., México",Restaurante mexicano,,Saltillo
Los Adobes,,None Found,+52 844 431 4736,"Blvd. Eulalio Gutiérrez Treviño 1110, Praderas Oriente, 25000 Saltillo, Coah., México",Restaurante mexicano, Cierra a las 11p.m.,Saltillo
Hacienda Los Compadres,loscompadres.mx,None Found,+52 844 688 5684,"Blvd. Luis Donaldo Colosio 2510, Torrecillas, 25204 Saltillo, Coah., México",Restaurante mexicano, Cierra a las 12a.m.,Saltillo
Taberna El Cerdo de Babel,,None Found,+52 844 135 5360,"C. Melchor Ocampo 324, Zona Centro, 25000 Saltillo, Coah., México",Bar restaurante, Cierra a las 2a.m.,Saltillo
La Puerta al Cielo,facebook.com,None Found,+52 844 688 4612,"Calle Ignacio Allende 148-Sur, Zona Centro, 25000 Saltillo, Coah., México",Restaurante, Cierra a la 1a.m.,Saltillo
Il Mercato Gentiloni,ilmercato.mx,None Found,+52 844 688 4545,"Boulevard la Gran Via, Blvd. Parque Centro 1454, 25279 Saltillo, Coah., México",Restaurante, Cierra a las 11p.m.,Saltillo
Kapú,instagram.com,None Found,+52 844 677 7711,"Blvrd Rufino Tamayo 220, Alpes Nte., 25253 Saltillo, Coah., México",Restaurante mexicano, Cierra a las 2a.m.,Saltillo
El Principal Centro Histórico,,None Found,+52 844 414 3384,"Calle Ignacio Allende 702, Zona Centro, 25000 Saltillo, Coah., México",Restaurante, Cierra a las 10p.m.,Saltillo
Villa de Saltillo,facebook.com,None Found,+52 844 410 1154,"C. Hidalgo 160, Zona Centro, 25000 Saltillo, Coah., México",Restaurante mexicano, Cierra a las 10p.m.,Saltillo
Lulu Cocina Y Vino,lulucocinayvino.com,None Found,+52 844 100 4148,"Los Valdez 6800, int A, Los Valdez, 25209 Saltillo, Coah., México",Restaurante occidental, Cierra a las 2a.m.,Saltillo
Terrazza Romana,ilmercatogentiloni.com,None Found,+52 844 688 4545,"Boulevard la Gran Via, Blvd. Parque Centro 1454, 25279 Saltillo, Coah., México",Restaurante italiano, Cierra a las 12a.m.,Saltillo
Güicho y Mina Cocina Mexicana,,None Found,+52 844 315 9551,"Gral. Victoriano Cepeda 351, Zona Centro, 25000 Saltillo, Coah., México",Restaurante mexicano,,Saltillo
Tuétanos Steakhouse,grupocego.com,None Found,+52 844 533 8282,"Blvd. Moctezuma 1359, Valle Real 1er Sector, 25204 Saltillo, Coah., México",Restaurante mexicano, Cierra a las 2a.m.,Saltillo
La Toscana,latoscanasaltillo.com,None Found,+52 844 688 5976,"Plaza Novva, Blvd. Jesús Valdez Sánchez #5330-Local 72, Las Praderas, 25294 Saltillo, Coah., México",Restaurante, Cierra a las 12a.m.,Saltillo
Copper Steakhouse,facebook.com,None Found,+52 844 485 2341,"Blvd. Luis Donaldo Colosio 1816, Residencial San Alberto, 25204 Saltillo, Coah., México",Restaurante especializado en filetes, Cierra a las 12a.m.,Saltillo
El Tapanco,facebook.com,None Found,+52 844 136 3090,"Blvd Galerias 715 Blvd Galerias, Blvd. Parque Centro 715, 25279 Saltillo, Coah., México",Restaurante mexicano,,Saltillo
La Cipolla,lacipolla.com,Un espacio acogedor con aire hogareño y terraza para tomar vino y probar platos italianos como pastas y pizza.,+52 844 165 0277,"Plaza Casa Grande, Blvd. José Musa de León 951-Local 24-A, Los Pinos, 25198 Saltillo, Coah., México",Restaurante italiano, Cierra a las 11:30p.m.,Saltillo
Don Tiburcio Musa,,Lugar festivo con techo de palmas para ver deportes y probar su especialidad de tacos de pescados y mariscos.,+52 844 485 1385,"Blvd. José Musa de León #464, Los Pinos 4to Sector, 25210 Saltillo, Coah., México",Restaurante, Cierra a las 11:30p.m.,Saltillo
Vía Nápoli,facebook.com,None Found,+52 844 431 9330,"Blvd. Pedro Figueroa, Residencial San Patricio, 25204 Saltillo, Coah., México",Restaurante italiano,,Saltillo
El Pastor,,"Parrilladas, tacos y botanas mexicanas en un espacio relajado con terraza, servicio al bar y área infantil.",+52 844 485 1785,"Blvd. Moctezuma 2475, Valle Real 1er Sector, 25204 Saltillo, Coah., México",Taquería, Cierra a las 4a.m.,Saltillo
La Casita Del Antojo,,None Found,+52 844 485 5000,"Juan Pablo Rodríguez de La Fuente Int. 3 A, Rancho de Peña, 25210 Saltillo, Coah., México",Restaurante mexicano, Cierra a las 12a.m.,Saltillo
Frida y Diego Restaurante Mexicano,facebook.com,None Found,+52 844 197 5917,"C. Guillermo Purcell 418, Zona Centro, 25000 Saltillo, Coah., México",Restaurante, Cierra a las 12a.m.,Saltillo
El Chivatito Principal,,Establecido local con ambiente casero y tradicional que se especializa en cabrito y carnes a la parrilla.,+52 844 417 6825,"Perif. Luis Echeverría 350, Lourdes, 25086 Saltillo, Coah., México",Restaurante mexicano, Cierra a las 11p.m.,Saltillo
V Carranza,,None Found,+52 844 180 5072,"Carr. Monterrey - Saltillo #8734, La Puerta del Sol, 25207 Saltillo, Coah., México",Restaurante mexicano, Cierra a las 2a.m.,Saltillo
La Mare Mestiza,lamaremestiza.com,None Found,+52 844 893 2018,"Blvd. Parque Centro, Sin Nombre de Col 16, 25240 Saltillo, Coah., México",Restaurante mexicano, Cierra a las 11p.m.,Saltillo
Bistro République,facebook.com,None Found,+52 844 180 0229,"C. Reynosa 212, República Oriente, 25280 Saltillo, Coah., México",Restaurante francés, Cierra a las 12a.m.,Saltillo
Restaurante Grillo 77,grillo77.com,None Found,+52 844 275 4640,"Boulevard Venustiano Carranza 4535 plaza O, Virreyes Residencial, 25230 Saltillo, Coah., México",Restaurante, Cierra a la 1:30a.m.,Saltillo
Carnes Finas de Saltillo,,None Found,+52 844 416 8789,"Salvador González Lobo 792, República Oriente, 25280 Saltillo, Coah., México",Restaurante de platos de carne, Cierra a las 11p.m.,Saltillo
La Penumbra,,None Found,+52 844 414 0223,"Lic. Benito Juárez 255, Zona Centro, 25000 Saltillo, Coah., México",Restaurante mexicano, 8p.m. ,Saltillo
Cántaros,,None Found,+52 844 415 4054,"Avenida Universidad 113, República, 25265 Saltillo, Coah., México",Restaurante mexicano, Cierra a las 10p.m.,Saltillo
San Pedro de Los González,facebook.com,Restaurante colorido decorado con curiosidades y antigüedades que sirve cocina mexicana a la carta o en bufé.,+52 844 432 2011,"Blvd. Eulalio Gutiérrez Treviño 3990, Los González, 25204 Saltillo, Coah., México",Restaurante mexicano, Cierra a las 11p.m.,Saltillo
Giardino,ilmercato.mx,None Found,+52 844 688 4545,"Boulevard Galerías 375 Sin Nombre de Col 16 25279, Sin Nombre de Colonia 16, 25279 Saltillo, Coah., México",Restaurante italiano, Cierra a las 2a.m.,Saltillo
Los Arbolitos de Cajeme Saltillo,mariscoslosarbolitos.com,None Found,+52 844 485 6473,"Blvd. Luis Donaldo Colosio 1817, Residencial San Patricio, 25204 Saltillo, Coah., México",Restaurante mexicano, Cierra a las 11p.m.,Saltillo
Corazón de María,facebook.com,"Local elegante de cocteles y bocadillos fusión, con paraguas colgantes coloridos y música en vivo.",+52 844 332 3017,"Blvd. Eulalio Gutiérrez Treviño 1500, El Baluarte, 25297 Saltillo, Coah., México",Restaurante mexicano, Cierra a las 2a.m.,Saltillo
Encanto Colombia,express.adobe.com,None Found,+52 844 728 1785,"C. Juan Aldama 362 Oriente, Zona Centro, 25000 Saltillo, Coah., México",Restaurante colombiano,,Saltillo
Noreste Grill,norestegrill.com.mx,Un espacio casual que sirve carne asadas y especialidades de México con una variedad de tequilas.,+52 844 431 8291,"Carr. a los González 365, Exhacienda, San José de los Cerritos, 25203 Saltillo, Coah., México",Restaurante, Cierra a las 12a.m.,Saltillo
El Apenitas Puerta del Sol,,Cortes de carne y especialidades mexicanas en un ambiente informal con decoraciónes típicas.,+52 844 432 3026,"Carr. Monterrey - Saltillo s/n, La Puerta del Sol, 25207 Saltillo, Coah., México",Restaurante mexicano, 8p.m. ,Saltillo
Los Compadres,loscompadres.mx,"Parrilladas, tacos y antojitos mexicanos en un restaurante rústico decorado con murales y toques campestres.",+52 844 103 9524,"Perif. Luis Echeverría 268, Latinoamericana, 25270 Saltillo, Coah., México",Restaurante mexicano, Cierra a las 12a.m.,Saltillo
Don Tiburcio Echeverria,facebook.com,None Found,+52 844 111 1210,"Perif. Luis Echeverría 1605, Lourdes, 25069 Saltillo, Coah., México",Marisquería, Cierra a las 12a.m.,Saltillo
PLAJÊ,,None Found,+52 844 432 3535,"Carr. Monterrey - Saltillo km 5.4, Residencial Privadas de Santiago, 25210 Saltillo, Coah., México",Restaurante, Cierra a las 12a.m.,Saltillo
Martins Saltillo,martins.com.mx,Luminoso restaurante familiar en donde se ofrece variado menú internacional con sabor mexicano.,+52 844 416 2633,"Blvrd Gral Francisco Coss, Zona Centro, 25000 Saltillo, Coah., México",Restaurante mexicano, Cierra a las 11p.m.,Saltillo
Taquería la Hacienda,,None Found,,"Calle Mariano Abasolo 2450, Guanajuato, 25280 Saltillo, Coah., México",Taquería, Cierra a las 4a.m.,Saltillo
Tres Cubiertos,,None Found,+52 844 416 9812,"Perif. Luis Echeverría 883, Latinoamericana 2da Amp, 25270 Saltillo, Coah., México",Restaurante mexicano, Cierra a las 9p.m.,Saltillo
Tacos Checo,tacoscheco.com,"Destino luminoso y sencillo con tacos, tortillas y carnes, café y postres.",+52 844 439 0390,"Calle Mariano Abasolo 2474, Guanajuato, 25280 Saltillo, Coah., México",Taquería, Cierra a las 3a.m.,Saltillo
Cenaduría Saltillo,,None Found,+52 844 485 0318,"Blvd. Pedro Figueroa 235_1, Rancho de Peña, 25210 Saltillo, Coah., México",Restaurante mexicano, Cierra a las 11p.m.,Saltillo
Akari Japanese Bistró,order.foodbot.ai,None Found,+52 844 222 4012,"Blvd. La Gran Vía, Blvd. Parque Centro 1426, 25230 Saltillo, Coah., México",Restaurante japonés, Cierra a las 11p.m.,Saltillo
L'Osteria,,None Found,+52 844 817 6732,"Adolfo López Mateos 551, Los Ángeles, 25256 Saltillo, Coah., México",Restaurante italiano, Cierra a las 11:30p.m.,Saltillo
Costeñito Saltillo Norte,rappi.com.mx,None Found,+52 844 432 0777,"Blvd. Venustiano Carranza 2302, Country Club, 25207 Saltillo, Coah., México",Restaurante familiar,,Saltillo
Tavola,facebook.com,None Found,+52 844 114 0409,"Ignacio Allende Sur 103, Zona Centro, 25000 Saltillo, Coah., México",Restaurante, Cierra a las 11:30p.m.,Saltillo
La Cabaña Smokehouse Saltillo Galerías,smokehouse.mx,None Found,+52 844 309 2005,"Blvd. Galerías 715, Los Parques, 25279 Saltillo, Coah., México",Zona de barbacoa, Cierra a las 11:30p.m.,Saltillo
La Cabaña Smokehouse Saltillo Galerías,smokehouse.mx,None Found,+52 844 309 2005,"Blvd. Galerías 715, Los Parques, 25279 Saltillo, Coah., México",Zona de barbacoa, Cierra a las 11:30p.m.,Saltillo
Sensação Saltillo,sensacao.com.mx,None Found,+52 844 432 1257,"Blvd. Venustiano Carranza KM 5.5, Los Rodríguez, 25204 Saltillo, Coah., México",Restaurante brasileño, Cierra a las 11p.m.,Saltillo
Botanero Moritas,botaneromoritas.com,None Found,+52 844 136 3244,"Blvd. Parque Centro 1370, Los Parques, 25279 Saltillo, Coah., México",Restaurante, Cierra a las 2a.m.,Saltillo
Picanha y Carvão Saltillo,picanha.com.mx,None Found,+52 844 141 2240,"Blvd. José Musa de León 2621, Valle Real 2do Sector, 25204 Saltillo, Coah., México",Restaurante brasileño, Cierra a las 11p.m.,Saltillo
Shot & Shot,shot-shot.com,None Found,+52 844 485 0918,"Blvrd Nazario San Ortiz Garza 2846, Los Lagos, 25250 Saltillo, Coah., México",Restaurante, Cierra a la 1a.m.,Saltillo
Los Valdez,facebook.com,None Found,+52 844 410 3495,"Pedro Agüero 712, Zona Centro, 25000 Saltillo, Coah., México",Taquería, Cierra a la 1a.m.,Saltillo
Rincón Mexicano,facebook.com,None Found,+52 844 327 1606,"Lic. Benito Juárez 314, Zona Centro, 25000 Saltillo, Coah., México",Restaurante, Cierra a la 1:20a.m.,Saltillo
Nohemi,,None Found,+52 844 414 6261,"Blvrd Gral Francisco Coss 850, Centro, 25000 Saltillo, Coah., México",Restaurante mexicano, Cierra a las 11p.m.,Saltillo
Horno & Piedra,,None Found,+52 844 432 2402,"Carr. Monterrey - Saltillo No. 8734, Valle Hermoso, 25207 Saltillo, Coah., México",Restaurante italiano, Cierra a las 12a.m.,Saltillo
Casa 1900,facebook.com,"Restaurante colorido con terraza y un ambiente animado, donde se ofrecen comidas caseras.",+52 844 414 3813,"C. Praxedis de la Peña 331, Zona Centro, 25000 Saltillo, Coah., México",Restaurante, Cierra a la 1:45a.m.,Saltillo
Asador 9 Nueve,facebook.com,"Restaurante grande y moderno en el que se sirven filetes de entrecot, mariscos asados, vino y tragos mezclados.",+52 844 252 4135,"Boulevard Venustiano Carranza, Carr. Monterrey - Saltillo 5015, 25210 Saltillo, Coah., México",Parrilla, Cierra a las 12a.m.,Saltillo
Casa Juárez,facebook.com,None Found,+52 844 415 0505,"Blvd. Venustiano Carranza 4535, Virreyes Residencial, 25230 Saltillo, Coah., México",Bar restaurante, Cierra a las 2:30a.m.,Saltillo
Oniria Resto Bar,facebook.com,None Found,+52 844 136 2093,"Miguel Hidalgo y Costilla Sur 442, Zona Centro, 25000 Saltillo, Coah., México",Restaurante vegetariano, Cierra a las 2a.m.,Saltillo
Oniria Resto Bar,facebook.com,None Found,+52 844 136 2093,"Miguel Hidalgo y Costilla Sur 442, Zona Centro, 25000 Saltillo, Coah., México",Restaurante vegetariano, Cierra a las 2a.m.,Saltillo
Italia Nostra,,None Found,+52 844 688 2987,"Venustiano Carranza Plaza Marshal, local 2, Los Rodríguez, 25200 Saltillo, Coah., México",Restaurante italiano, Cierra a las 11p.m.,Saltillo
La Oaxaqueña,,None Found,+52 844 314 1401,"Calle Mariano Abasolo 525, Zona Centro, 25000 Saltillo, Coah., México",Restaurante mexicano, Cierra a las 4a.m.,Saltillo
Estación Coyoacán,estacioncoyoacan.com,None Found,+52 844 870 2041,"Blvd. Jesús Valdez Sánchez 4695b, Bonanza, 25296 Saltillo, Coah., México",Restaurante mexicano,,Saltillo
La Casa del Caballo,lacasadelcaballo.mx,None Found,+52 844 462 0306,"Blvd Corporativo 135 Planta Baja, Blvd. Parque Centro, 25279 Saltillo, Coah., México",Bar,,Saltillo
Restaurante El Radio,facebook.com,None Found,+52 844 181 6092,"Privada El Minero 211, Los Geranios, 25290 Saltillo, Coah., México",Restaurante, Cierra a las 11p.m.,Saltillo
Las Escolleras,lasescolleras.com.mx,Restaurante informal con ambiente tradicional y servicio a domicilio que sirve cocina de mar estilo Saltillo.,+52 844 439 1133,"Perif. Luis Echeverría 319-Int. 1, Latinoamericana, 25270 Saltillo, Coah., México",Marisquería, Abre a las 11a.m. del dom,Saltillo
Matsuri Ramen,order.foodbot.ai,None Found,+52 844 688 8557,"Blvd. Venustiano Carranza 2775, República, 25280 Saltillo, Coah., México",Restaurante, Cierra a las 10p.m.,Saltillo
Terraza Juarez,facebook.com,None Found,+52 844 448 1586,"Guadalupe Victoria 762, Zona Centro, 25000 Saltillo, Coah., México",Restaurante mexicano, Cierra a la 1:30a.m.,Saltillo
Coralillo,facebook.com,None Found,+52 844 136 5996,"Gral. Nicolás Bravo 320, Zona Centro, 25000 Saltillo, Coah., México",Restaurante, Cierra a las 2a.m.,Saltillo
Las Escolleras,lasescolleras.com.mx,None Found,+52 844 410 1000,"Blvrd Gral Francisco Coss 1029, Zona Centro, 25000 Saltillo, Coah., México",Marisquería, 7:30p.m. ,Saltillo
Sheriff Abasolo,,None Found,+52 844 415 1444,"Calle Mariano Abasolo Nte 2371, República Oriente, 25280 Saltillo, Coah., México",Restaurante mexicano, Cierra a las 4a.m.,Saltillo
Sol y Luna,,None Found,+52 844 415 5181,"Av. Venustiano Carranza 1790 esquina con, Campeche, República, 25280 Saltillo, Coah., México",Restaurante mexicano, Cierra a las 10p.m.,Saltillo
El Álamo,,None Found,+52 844 688 4545,"Boulevard la Gran Via, Blvd. Parque Centro 1454, 25279 Saltillo, Coah., México",Restaurante, Cierra a la 1a.m.,Saltillo
La Cocina de Angélica,,None Found,+52 844 410 7616,"José María LaFragua 460, Zona Centro, 25000 Saltillo, Coah., México",Restaurante, Abre a las 8a.m. del dom,Saltillo
El Papalote Taco & Grill,elpapalote.com,None Found,+52 844 787 3323,"y ave, Blvd. Venustiano Carranza, Av. La Salle 3040, Kiosco, 25240 Saltillo, Coah., México",Restaurante tex-mex, Cierra a las 12a.m.,Saltillo
Cimaco Gourmet,gourmetcimaco.com.mx,None Found,+52 844 438 5707,"Plaza Patio Ex-Hacienda de, San José de Los Cerritos 25296, 25010 Saltillo, Coah., México",Restaurante, Cierra a las 10:30p.m.,Saltillo
Alado Cocina & Cantina,,None Found,+52 844 218 3583,"Calle Bravo Nº 360 entre Aldama y, Calle Gral. Manuel Pérez Treviño, 25000 Saltillo, Coah., México",Restaurante mexicano, Cierra a las 2a.m.,Saltillo
Casa Vieja sabor y leyenda,facebook.com,None Found,+52 844 503 1016,"del lado izquierdo. Fachada de ladrillo, calle General Cepeda sur 765 antes de llegar a la iglesia ojo de agua, sobre la, Rafael Cepeda, 2 árboles afuera, 25000 Saltillo, Coah., México",Restaurante mexicano, Abre a las 9a.m. del dom,Saltillo
La Carmenta,,"Restaurante sencillo en el que se ofrecen platos tradicionales, como chilaquiles y enchiladas.",+52 844 410 2609,"Dionisio García Fuentes 996, Centro, 25000 Saltillo, Coah., México",Restaurante mexicano, Abre a las 8a.m. del dom,Saltillo
Toks Saltillo,toks.com.mx,None Found,+52 844 431 8935,"Carretera a los González 365 Sub Ancla Exterior 4 Colonia Exhacienda de, San José de Los Cerritos, San José de los Cerritos, 25010 Saltillo, Coah., México",Restaurante mexicano, Cierra a las 11p.m.,Saltillo
Deybs BBQ,,None Found,+52 844 380 5733,"José María LaFragua 776, Cumbres 2da Amp, 25270 Saltillo, Coah., México",Restaurante, Cierra a las 10p.m.,Saltillo
Costeñito Republica Saltillo,,None Found,+52 844 305 2605,"Blvd. Venustiano Carranza 2137, República Poniente, 25265 Saltillo, Coah., México",Restaurante,,Saltillo
Costeñito Republica Saltillo,,None Found,+52 844 305 2605,"Blvd. Venustiano Carranza 2137, República Poniente, 25265 Saltillo, Coah., México",Restaurante,,Saltillo
Amore Mio,,None Found,+52 844 426 2570,"Emilio Castelar 390, Zona Centro, 25000 Saltillo, Coah., México",Restaurante italiano, Cierra a las 11p.m.,Saltillo
El toke Argentino,eltokeargentino.com,None Found,+52 844 502 1660,"25230, Villa Olímpica, 25230 Saltillo, Coah., México",Restaurante de comida para llevar, Abre a las 11a.m. del lun,Saltillo
La Carreta del Abuelo,facebook.com,None Found,+52 844 134 0889,"Blvd. Isidro López Zertuche 2996, La Salle, 25240 Saltillo, Coah., México",Restaurante mexicano, Abre a las 8a.m. del lun,Saltillo
Café Fiore,,None Found,+52 844 415 2404,"Ecuador #521, Latinoamericana 1ra Amp, 25270 Saltillo, Coah., México",Cafetería, Cierra a las 3a.m.,Saltillo
Oriental Grill Saltillo,orientalgrill.com.mx,None Found,+52 844 688 7456,"Blvd. Parque Centro 1425-L-H, Los Parques, 25279 Saltillo, Coah., México",Restaurante asiático, Cierra a las 11p.m.,Saltillo
"Los Nahuales, Cocina & Cantina Mexicana",,None Found,,"Calle Mariano Abasolo 472, Zona Centro, 25000 Saltillo, Coah., México",Restaurante mexicano, Cierra a las 5a.m. del dom,Saltillo
Taqueria Los Molkas,,None Found,+52 844 228 1563,"Calle Mariano Abasolo 2998, Latinoamericana 5ta Amp, 25270 Saltillo, Coah., México",Taquería, Cierra a las 2a.m.,Saltillo
Mariscos La Fragata,,None Found,+52 844 439 3151,"Blvrd Humberto Hinojosa Domínguez 477, Kiosco Amp, 25240 Saltillo, Coah., México",Marisquería, Cierra a las 8:30p.m.,Saltillo
Terraza Saltillo,,None Found,+52 844 869 2225,"Perif. Luis Echeverría LB, Sin Nombre de Col 2, 25092 Saltillo, Coah., México",Restaurante familiar, Cierra a las 11p.m.,Saltillo
Humonegro,,None Found,+52 844 739 9690,"Blvd. Jesús Valdez Sánchez 1861, El Olmo, 25280 Saltillo, Coah., México",Restaurante mexicano, Cierra a la 1:30a.m.,Saltillo
Restaurante Liverpool,liverpool.com.mx,None Found,,"Blvrd. Nazario Ortiz Garza 2345, Colonia Tanque de Peña, 25279 Saltillo, Coah., México",Restaurante, Abre a las 9a.m. del dom,Saltillo
Matsumoto Japanese Cuisine,,None Found,+52 844 688 1932,"Blvd. Eulalio Gutiérrez Treviño 2711, Los González, 25204 Saltillo, Coah., México",Restaurante japonés auténtico, Cierra a las 2a.m.,Saltillo
Matsumoto Japanese Cuisine,,None Found,+52 844 688 1932,"Blvd. Eulalio Gutiérrez Treviño 2711, Los González, 25204 Saltillo, Coah., México",Restaurante japonés auténtico, Cierra a las 2a.m.,Saltillo
Taquería La Flama,,None Found,+52 844 148 2824,"25280, Calle Mariano Abasolo 2376, Guanajuato, 25280 Saltillo, Coah., México",Taquería, Cierra a las 3a.m.,Saltillo
El Mar - La Mejor cocina de Mazatlan,facebook.com,None Found,+52 844 563 6143,"Blvd. Jesús Valdez Sánchez 2001, Las Praderas, 25295 Saltillo, Coah., México",Marisquería, 7:30p.m. ,Saltillo
Vips Los Parques Saltillo,vips.com.mx,None Found,+52 55 8007 2613,"Blvd. Nazario Ortiz 2345, Col. Tanque de Peña, 25279 Saltillo, Coah., México",Restaurante mexicano, Cierra a las 10p.m.,Saltillo
Westrockers,wrslosahijados.com,None Found,+52 844 418 0397,"frente al campo de golf Plaza La Sierra, Av. 20 388, Lourdes, 25092 Saltillo, Coah., México",Restaurante, Abre a las 8:30a.m. del dom,Saltillo
Sake Grill,,None Found,+52 844 249 8751,"Calle Mariano Abasolo 2998-A, Latinoamericana 5ta Amp, 25270 Saltillo, Coah., México",Restaurante de sushi, Cierra a las 12a.m.,Saltillo
Sirloin Stockade,sirloin.mx,None Found,+52 844 309 0918,"Blvd. Nazario Silvestre Ortiz Garza 2345, Int 305, Sin Nombre de Col 16, 25279 Saltillo, Coah., México",Restaurante americano, Cierra a las 10p.m.,Saltillo
La Capilla,,None Found,+52 844 415 6300,"Blvd. Venustiano Carranza 2035, República Poniente, 25265 Saltillo, Coah., México",Restaurante mexicano, Abre a las 8a.m. del lun,Saltillo
Al Sazón Mexicano,grupocego.com,"Local animado con decoración tradicional en el que se ofrecen platos populares, como chilaquiles y tacos.",+52 844 437 0064,"Carr. Monterrey - Saltillo 3150, Jardín, 25240 Saltillo, Coah., México",Restaurante mexicano, Abre a las 8a.m. del dom,Saltillo
Pizza Rock Periférico,pizzarock.mx,Bar y restaurante de comida italiana ofrecida en un íntimo espacio con escenario para música de rock en vivo.,+52 844 439 0099,"Perif. Luis Echeverría s/n, Guanajuato Oriente, 25286 Saltillo, Coah., México",Pizzería, Cierra a las 2a.m.,Saltillo
Taqueria La Huasteca Potosina Almuerzos Y Gorditas,,None Found,+52 844 176 9512,"Perif. Luis Echeverría SN-C FERREMAYOREO, Sin Nombre de Col 9, 25280 Saltillo, Coah., México",Restaurante, Cierra a las 12a.m.,Saltillo
Tacos Los Pioneros,lospionerosdesaltillo.com,"Comedor rústico con atmósfera informal en donde se ofrecen tacos, tortas y antojitos mexicanos tradicionales.",+52 844 485 4453,"Carr. Monterrey - Saltillo 25000, Rancho de Peña, 25210 Saltillo, Coah., México",Taquería, Abre a las 7a.m. del dom,Saltillo
